"[D520000] Statement of cash flows, indirect method - Consolidated financial statements (Unit: KRW)","[D520000] Statement of cash flows, indirect method - Consolidated financial statements (Unit: KRW)","[D520000] Statement of cash flows, indirect method - Consolidated financial statements (Unit: KRW)","[D520000] Statement of cash flows, indirect method - Consolidated financial statements (Unit: KRW)","[D520000] Statement of cash flows, indirect method - Consolidated financial statements (Unit: KRW)","[D520000] Statement of cash flows, indirect method - Consolidated financial statements (Unit: KRW)","[D520000] Statement of cash flows, indirect method - Consolidated financial statements (Unit: KRW)",20190101-20191231,20180101-20181231,20170101-20171231
concept_id,label_ko,label_en,class0,class1,class2,class3,"('연결재무제표',)","('연결재무제표',)","('연결재무제표',)"
ifrs-full_CashFlowsFromUsedInOperatingActivities,영업활동으로 인한 현금흐름,Cash flows from (used in) operating activities,현금흐름표 [abstract],영업활동으로 인한 현금흐름,,,8008968530.0,12429013359.0,-1940830108.0
dart_ProfitLossForStatementOfCashFlows,당기순이익(손실),Profit (loss),현금흐름표 [abstract],영업활동으로 인한 현금흐름,당기순이익(손실),,-3317375884.0,5339651105.0,4089755582.0
ifrs-full_AdjustmentsForReconcileProfitLoss,현금의 유출이 없는 비용등의 가산,Adjustments to reconcile profit (loss),현금흐름표 [abstract],영업활동으로 인한 현금흐름,현금의 유출이 없는 비용등의 가산,,20554645232.0,22681280713.0,21105325927.0
dart_AdjustmentsForDepreciationExpense,감가상각비,Adjustments for depreciation expense,현금흐름표 [abstract],영업활동으로 인한 현금흐름,현금의 유출이 없는 비용등의 가산,감가상각비,11677335904.0,12717568942.0,11471002784.0
dart_AdjustmentsForProvisionForSeveranceIndemnities,퇴직급여,Adjustments for provision for severance indemnities,현금흐름표 [abstract],영업활동으로 인한 현금흐름,현금의 유출이 없는 비용등의 가산,퇴직급여,1981530780.0,1481976468.0,1218260268.0
dart_AdjustmentsForAmortisationExpense,무형자산상각비,Adjustments for amortisation expense,현금흐름표 [abstract],영업활동으로 인한 현금흐름,현금의 유출이 없는 비용등의 가산,무형자산상각비,288100695.0,167236057.0,173813906.0
dart_AdjustmentsForBadDebtExpenses,대손상각비(환입),Adjustments for bad debt expenses,현금흐름표 [abstract],영업활동으로 인한 현금흐름,현금의 유출이 없는 비용등의 가산,대손상각비(환입),-1049537415.0,2863792194.0,1351803952.0
entity00625942_udf_CF_2019118173429786_AdjustmentsForReconcileProfitLoss,지급임차료,Provision rent,현금흐름표 [abstract],영업활동으로 인한 현금흐름,현금의 유출이 없는 비용등의 가산,지급임차료,,50342994.0,54228840.0
dart_AdjustmentsForInterestExpenses,이자비용,Adjustments for Interest expenses,현금흐름표 [abstract],영업활동으로 인한 현금흐름,현금의 유출이 없는 비용등의 가산,이자비용,3496918324.0,3809348831.0,5056028884.0
dart_AdjustmentsForLossesOnForeignExchangeTranslations,외화환산손실,Adjustments for losses on foreign exchange translations,현금흐름표 [abstract],영업활동으로 인한 현금흐름,현금의 유출이 없는 비용등의 가산,외화환산손실,,515878408.0,556506745.0
dart_AdjustmentsForLossesFromRedemptionOfBorrowings,사채상환손실,Adjustments for losses from redemption of borrowings,현금흐름표 [abstract],영업활동으로 인한 현금흐름,현금의 유출이 없는 비용등의 가산,사채상환손실,,,325039995.0
dart_AdjustmentsForImpairmentLossesOnAvailableForSaleFinancialAssets,매도가능금융자산손상차손,Adjustments for impairment losses on available-for-sale financial assets,현금흐름표 [abstract],영업활동으로 인한 현금흐름,현금의 유출이 없는 비용등의 가산,매도가능금융자산손상차손,,,99999000.0
dart_AdjustmentsForLossesOnDispositionOfPropertyPlantAndEquipment,유형자산처분손실,Adjustments for losses on disposition of property plant and equipment,현금흐름표 [abstract],영업활동으로 인한 현금흐름,현금의 유출이 없는 비용등의 가산,유형자산처분손실,20471681.0,5384406.0,
dart_AdjustmentsForImpairmentLossesOfPropertyPlantAndEquipment,유형자산손상차손,Adjustments for impairment losses of property plant and equipment,현금흐름표 [abstract],영업활동으로 인한 현금흐름,현금의 유출이 없는 비용등의 가산,유형자산손상차손,4139559121.0,,
dart_AdjustmentsForImpairmentLossesOfIntangibleAssets,무형자산손상차손,Adjustments for impairment losses of intangible assets,현금흐름표 [abstract],영업활동으로 인한 현금흐름,현금의 유출이 없는 비용등의 가산,무형자산손상차손,36047200.0,,
dart_AdjustmentsForLossesOnDisposalsOfIntangibleAssets,무형자산처분손실,Adjustments for losses on disposals of intangible assets,현금흐름표 [abstract],영업활동으로 인한 현금흐름,현금의 유출이 없는 비용등의 가산,무형자산처분손실,72963588.0,,
dart_AdjustmentsForOtherBadDebtExpenses,기타의 대손상각비,Adjustments for other bad debt expenses,현금흐름표 [abstract],영업활동으로 인한 현금흐름,현금의 유출이 없는 비용등의 가산,기타의 대손상각비,201559804.0,70000000.0,
ifrs-full_AdjustmentsForIncomeTaxExpense,법인세비용(수익),Adjustments for income tax expense,현금흐름표 [abstract],영업활동으로 인한 현금흐름,현금의 유출이 없는 비용등의 가산,법인세비용(수익),-2850951713.0,-529165107.0,622102669.0
entity00625942_udf_CF_2019118173532747_AdjustmentsForReconcileProfitLoss,기타의영업외비용,Other Non-operating Expenses,현금흐름표 [abstract],영업활동으로 인한 현금흐름,현금의 유출이 없는 비용등의 가산,기타의영업외비용,,547941116.0,155692400.0
dart_AdjustmentsForWritedownsOfInventories,재고자산평가손실,Adjustments for write-downs of inventories,현금흐름표 [abstract],영업활동으로 인한 현금흐름,현금의 유출이 없는 비용등의 가산,재고자산평가손실,1513771064.0,907200195.0,
entity00625942_udf_CF_2019118173552523_AdjustmentsForReconcileProfitLoss,기타감가상각비,Depreciation Expenses on Other,현금흐름표 [abstract],영업활동으로 인한 현금흐름,현금의 유출이 없는 비용등의 가산,기타감가상각비,20846484.0,20846484.0,20846484.0
dart_AdjustmentsForLossesOnEvaluationOfDerivativeFinancialLiabilities,파생상품관련손실,Adjustments for losses on evaluation of derivative financial liabilities,현금흐름표 [abstract],영업활동으로 인한 현금흐름,현금의 유출이 없는 비용등의 가산,파생상품관련손실,379077390.0,25401300.0,
entity00625942_udf_CF_201911817369659_AdjustmentsForReconcileProfitLoss,지급수수료,Commissions,현금흐름표 [abstract],영업활동으로 인한 현금흐름,현금의 유출이 없는 비용등의 가산,지급수수료,547890000.0,,
dart_AdjustmentsForLossesOnDisposalsOfReceivables,매출채권처분손실,Adjustments for losses on disposals of receivables,현금흐름표 [abstract],영업활동으로 인한 현금흐름,현금의 유출이 없는 비용등의 가산,매출채권처분손실,,5087526.0,
dart_AdjustmentsForMiscellaneousLosses,잡손실,Adjustments for miscellaneous losses,현금흐름표 [abstract],영업활동으로 인한 현금흐름,현금의 유출이 없는 비용등의 가산,잡손실,,22440899.0,
entity00625942_udf_CF_2020321193057412_AdjustmentsForReconcileProfitLoss,당기손익-공정가치측정금융자산처분손실,Loss on disposal of financial assets at fair value through profit or loss,현금흐름표 [abstract],영업활동으로 인한 현금흐름,현금의 유출이 없는 비용등의 가산,당기손익-공정가치측정금융자산처분손실,63258289.0,,
entity00625942_udf_CF_202032119327407_AdjustmentsForReconcileProfitLoss,당기손익-공정가치측정금융자산평가손실,Net Income-Fair Value Measurement Financial Asset Valuation Loss,현금흐름표 [abstract],영업활동으로 인한 현금흐름,현금의 유출이 없는 비용등의 가산,당기손익-공정가치측정금융자산평가손실,15804036.0,,
entity00625942_udf_CF_2019118173642737_CashFlowsFromUsedInOperatingActivities,현금의 유입이 없는 수익등의 차감,Adjustments to reconcile loss,현금흐름표 [abstract],영업활동으로 인한 현금흐름,현금의 유입이 없는 수익등의 차감,,1094365382.0,601840548.0,862050586.0
entity00625942_udf_CF_201911817365926_udf_CF_2019118173642737_CashFlowsFromUsedInOperatingActivities,외화환산이익,Adjustments for gain on foreign exchange translations,현금흐름표 [abstract],영업활동으로 인한 현금흐름,현금의 유입이 없는 수익등의 차감,외화환산이익,50006535.0,508090577.0,30374563.0
entity00625942_udf_CF_2019118173711272_udf_CF_2019118173642737_CashFlowsFromUsedInOperatingActivities,이자수익,Interest income - other,현금흐름표 [abstract],영업활동으로 인한 현금흐름,현금의 유입이 없는 수익등의 차감,이자수익,141263488.0,59503248.0,110133039.0
entity00625942_udf_CF_2019118173720781_udf_CF_2019118173642737_CashFlowsFromUsedInOperatingActivities,유형자산처분이익,Adjustments for gain on disposition of tangible assets,현금흐름표 [abstract],영업활동으로 인한 현금흐름,현금의 유입이 없는 수익등의 차감,유형자산처분이익,802602859.0,4098057.0,16365790.0
entity00625942_udf_CF_2020321195144880_udf_CF_2019118173642737_CashFlowsFromUsedInOperatingActivities,재고자산평가손실 환입,Inventory valuation loss reversal,현금흐름표 [abstract],영업활동으로 인한 현금흐름,현금의 유입이 없는 수익등의 차감,재고자산평가손실 환입,,,679661398.0
entity00625942_udf_CF_2019118173732652_udf_CF_2019118173642737_CashFlowsFromUsedInOperatingActivities,기타영업외수익,Other non-operating income,현금흐름표 [abstract],영업활동으로 인한 현금흐름,현금의 유입이 없는 수익등의 차감,기타영업외수익,32634423.0,8154225.0,25515796.0
entity00625942_udf_CF_202032119498621_udf_CF_2019118173642737_CashFlowsFromUsedInOperatingActivities,잡이익,Miscellaneous profit,현금흐름표 [abstract],영업활동으로 인한 현금흐름,현금의 유입이 없는 수익등의 차감,잡이익,,994441.0,
entity00625942_udf_CF_2019118173744866_udf_CF_2019118173642737_CashFlowsFromUsedInOperatingActivities,파생상품거래이익,Gains on transaction of derivative financial instrument,현금흐름표 [abstract],영업활동으로 인한 현금흐름,현금의 유입이 없는 수익등의 차감,파생상품거래이익,16750000.0,21000000.0,
entity00625942_udf_CF_2019118173858407_udf_CF_2019118173642737_CashFlowsFromUsedInOperatingActivities,무형자산처분이익,Intangible Assets Gains,현금흐름표 [abstract],영업활동으로 인한 현금흐름,현금의 유입이 없는 수익등의 차감,무형자산처분이익,22699293.0,,
entity00625942_udf_CF_2019118173911703_udf_CF_2019118173642737_CashFlowsFromUsedInOperatingActivities,당기손익-공정가치측정금융자산처분이익,Gains or losses on disposal of financial assets at fair value through profit or loss,현금흐름표 [abstract],영업활동으로 인한 현금흐름,현금의 유입이 없는 수익등의 차감,당기손익-공정가치측정금융자산처분이익,20526989.0,,
entity00625942_udf_CF_202032119500496_udf_CF_2019118173642737_CashFlowsFromUsedInOperatingActivities,당기손익-공정가치측정금융자산평가이익,Net Income-Fair Value Measurement Financial Asset Valuation Profit,현금흐름표 [abstract],영업활동으로 인한 현금흐름,현금의 유입이 없는 수익등의 차감,당기손익-공정가치측정금융자산평가이익,7881795.0,,
dart_AdjustmentsForAssetsLiabilitiesOfOperatingActivities,영업활동으로인한자산ㆍ부채의변동,Adjustments for assets and liabilities of operating activities,현금흐름표 [abstract],영업활동으로 인한 현금흐름,영업활동으로인한자산ㆍ부채의변동,,-3470733979.0,-10905467064.0,-23918323566.0
ifrs-full_AdjustmentsForDecreaseIncreaseInTradeAccountReceivable,매출채권의 감소(증가),Adjustments for increase in trade accounts receivable,현금흐름표 [abstract],영업활동으로 인한 현금흐름,영업활동으로인한자산ㆍ부채의변동,매출채권의 감소(증가),4259987621.0,-596354443.0,-1834050260.0
dart_AdjustmentsForDecreaseincreaseInAdvancePayments,선급금의 감소(증가),Adjustments for increase in advance payments,현금흐름표 [abstract],영업활동으로 인한 현금흐름,영업활동으로인한자산ㆍ부채의변동,선급금의 감소(증가),47942020.0,4924977788.0,-4476600100.0
dart_AdjustmentsForDecreaseincreaseInPrepaidExpenses,선급비용의 감소(증가),Adjustments for decrease (increase) in prepaid expenses,현금흐름표 [abstract],영업활동으로 인한 현금흐름,영업활동으로인한자산ㆍ부채의변동,선급비용의 감소(증가),195909905.0,217225418.0,-10470763.0
dart_AdjustmentsForDecreaseincreaseInOtherReceivables,미수금의 감소(증가),Adjustments for increase in other receivables,현금흐름표 [abstract],영업활동으로 인한 현금흐름,영업활동으로인한자산ㆍ부채의변동,미수금의 감소(증가),-257705213.0,253163678.0,-32907691.0
ifrs-full_AdjustmentsForDecreaseIncreaseInInventories,재고자산의 감소(증가),Adjustments for increase in inventories,현금흐름표 [abstract],영업활동으로 인한 현금흐름,영업활동으로인한자산ㆍ부채의변동,재고자산의 감소(증가),3411263846.0,-11065858585.0,-13176393740.0
ifrs-full_AdjustmentsForIncreaseDecreaseInTradeAccountPayable,매입채무의 감소,Adjustments for increase (decrease) in trade accounts payable,현금흐름표 [abstract],영업활동으로 인한 현금흐름,영업활동으로인한자산ㆍ부채의변동,매입채무의 감소,-4638097605.0,-3194732454.0,-2287791928.0
dart_AdjustmentsForIncreasedecreaseInOtherPayables,미지급금의 증가(감소),Adjustments for increase (decrease) in other payables,현금흐름표 [abstract],영업활동으로 인한 현금흐름,영업활동으로인한자산ㆍ부채의변동,미지급금의 증가(감소),-827439984.0,-314251110.0,1848022755.0
dart_AdjustmentsForIncreasedecreaseInAccruedExpenses,미지급비용의 증가(감소),Adjustments for increase (decrease) in accrued Expenses,현금흐름표 [abstract],영업활동으로 인한 현금흐름,영업활동으로인한자산ㆍ부채의변동,미지급비용의 증가(감소),-114066746.0,852498686.0,582951689.0
dart_AdjustmentsForIncreasedecreaseInAdvancesCustomers,선수금의 감소,Adjustments for increase (decrease) in advances customers,현금흐름표 [abstract],영업활동으로 인한 현금흐름,영업활동으로인한자산ㆍ부채의변동,선수금의 감소,-2172405838.0,-245967787.0,-2562415285.0
dart_AdjustmentsForIncreasedecreaseInWithholdingsBanks,예수금의 증가(감소),Adjustments for increase (decrease) in withholdings Banks,현금흐름표 [abstract],영업활동으로 인한 현금흐름,영업활동으로인한자산ㆍ부채의변동,예수금의 증가(감소),125318780.0,-266245419.0,258612805.0
entity00625942_udf_CF_2019111015134361_AdjustmentsForAssetsLiabilitiesOfOperatingActivities,부가세대급금의 감소(증가),Prepaid Value Added Tax of increase,현금흐름표 [abstract],영업활동으로 인한 현금흐름,영업활동으로인한자산ㆍ부채의변동,부가세대급금의 감소(증가),230897591.0,675470919.0,-388307311.0
entity00625942_udf_CF_2019111015157422_AdjustmentsForAssetsLiabilitiesOfOperatingActivities,순확정급여부채의 감소,Increase of the net defined benefit liability,현금흐름표 [abstract],영업활동으로 인한 현금흐름,영업활동으로인한자산ㆍ부채의변동,순확정급여부채의 감소,-3065309776.0,-2210352616.0,-1838973737.0
entity00625942_udf_CF_2019111015218271_AdjustmentsForAssetsLiabilitiesOfOperatingActivities,계약자산의 증가,Contract Asset,현금흐름표 [abstract],영업활동으로 인한 현금흐름,영업활동으로인한자산ㆍ부채의변동,계약자산의 증가,-123751313.0,-478318406.0,
entity00625942_udf_CF_2019111015225861_AdjustmentsForAssetsLiabilitiesOfOperatingActivities,계약부채의 증가(감소),contract liabilities,현금흐름표 [abstract],영업활동으로 인한 현금흐름,영업활동으로인한자산ㆍ부채의변동,계약부채의 증가(감소),-543277267.0,543277267.0,
entity00625942_udf_CF_2019111015332821_CashFlowsFromUsedInOperatingActivities,영업활동으로 인한 현금수취액,Cash receiving due to business activity,현금흐름표 [abstract],영업활동으로 인한 현금흐름,영업활동으로 인한 현금수취액,,81748964.0,48798999.0,54278534.0
entity00625942_udf_CF_2019111015350580_udf_CF_2019111015332821_CashFlowsFromUsedInOperatingActivities,이자수익 수취,Interest received,현금흐름표 [abstract],영업활동으로 인한 현금흐름,영업활동으로 인한 현금수취액,이자수익 수취,81748964.0,48798999.0,54278534.0
entity00625942_udf_CF_201911101546803_CashFlowsFromUsedInOperatingActivities,영업활동으로 인한 현금지급액,Cash pressing due to business activity,현금흐름표 [abstract],영업활동으로 인한 현금흐름,영업활동으로 인한 현금지급액,,4744950421.0,4133409846.0,2409815999.0
entity00625942_udf_CF_2019111015428774_udf_CF_201911101546803_CashFlowsFromUsedInOperatingActivities,이자비용 지급,Interest profit pressing,현금흐름표 [abstract],영업활동으로 인한 현금흐름,영업활동으로 인한 현금지급액,이자비용 지급,3441462202.0,2945617562.0,2242023407.0
entity00625942_udf_CF_2019111015446500_udf_CF_201911101546803_CashFlowsFromUsedInOperatingActivities,법인세납부,Income taxes paid,현금흐름표 [abstract],영업활동으로 인한 현금흐름,영업활동으로 인한 현금지급액,법인세납부,1303488219.0,1187792284.0,167792592.0
ifrs-full_CashFlowsFromUsedInInvestingActivities,투자활동으로 인한 현금흐름,Cash flows from (used in) investing activities,현금흐름표 [abstract],투자활동으로 인한 현금흐름,,,3639331894.0,-22293275485.0,-19173514862.0
entity00625942_udf_CF_2019111015535167_CashFlowsFromUsedInInvestingActivities,투자활동으로 인한 현금유입액,Cash inflow due to investment activity,현금흐름표 [abstract],투자활동으로 인한 현금흐름,투자활동으로 인한 현금유입액,,9540668798.0,1246153428.0,298407186.0
entity00625942_udf_CF_2019111015738771_udf_CF_2019111015535167_CashFlowsFromUsedInInvestingActivities,단기대여금의 회수,Purchase of short-term loans,현금흐름표 [abstract],투자활동으로 인한 현금흐름,투자활동으로 인한 현금유입액,단기대여금의 회수,694871373.0,161511359.0,209941738.0
entity00625942_udf_CF_2019111015751291_udf_CF_2019111015535167_CashFlowsFromUsedInInvestingActivities,단기금융상품의 감소,Proceeds from sales of short-term financial instruments,현금흐름표 [abstract],투자활동으로 인한 현금흐름,투자활동으로 인한 현금유입액,단기금융상품의 감소,330000000.0,376848251.0,55577208.0
entity00625942_udf_CF_201911101586204_udf_CF_2019111015535167_CashFlowsFromUsedInInvestingActivities,보증금의 감소,Adjustments for increase in deposits provided,현금흐름표 [abstract],투자활동으로 인한 현금흐름,투자활동으로 인한 현금유입액,보증금의 감소,1085692911.0,645312000.0,5179150.0
entity00625942_udf_CF_2019111015821322_udf_CF_2019111015535167_CashFlowsFromUsedInInvestingActivities,유형자산의 처분,Disposal of tangible assets,현금흐름표 [abstract],투자활동으로 인한 현금흐름,투자활동으로 인한 현금유입액,유형자산의 처분,208590910.0,41681818.0,27709090.0
entity00625942_udf_CF_2019111015847337_udf_CF_2019111015535167_CashFlowsFromUsedInInvestingActivities,무형자산의 처분,Disposal  of intangible assets,현금흐름표 [abstract],투자활동으로 인한 현금흐름,투자활동으로 인한 현금유입액,무형자산의 처분,535454545.0,,
entity00625942_udf_CF_2019111015859267_udf_CF_2019111015535167_CashFlowsFromUsedInInvestingActivities,파생상품의 처분,Disposition of derivatives,현금흐름표 [abstract],투자활동으로 인한 현금흐름,투자활동으로 인한 현금유입액,파생상품의 처분,,20800000.0,
entity00625942_udf_CF_2019111015926446_udf_CF_2019111015535167_CashFlowsFromUsedInInvestingActivities,기타포괄손익-공정가치측정금융자산의 처분,Disposition of fair value measurement financial assets through other comprehensive,현금흐름표 [abstract],투자활동으로 인한 현금흐름,투자활동으로 인한 현금유입액,기타포괄손익-공정가치측정금융자산의 처분,40048200.0,,
entity00625942_udf_CF_2020321201844961_udf_CF_2019111015535167_CashFlowsFromUsedInInvestingActivities,수익증권의 처분,Disposition of beneficiary certificates,현금흐름표 [abstract],투자활동으로 인한 현금흐름,투자활동으로 인한 현금유입액,수익증권의 처분,218474146.0,,
entity00625942_udf_CF_2019111015105588_udf_CF_2019111015535167_CashFlowsFromUsedInInvestingActivities,매각예정자산의 처분,Disposal of assets held for sale,현금흐름표 [abstract],투자활동으로 인한 현금흐름,투자활동으로 인한 현금유입액,매각예정자산의 처분,3207400000.0,,
entity00625942_udf_CF_2020321201949209_udf_CF_2019111015535167_CashFlowsFromUsedInInvestingActivities,장기금융상품의 감소,Decrease in long-term financial instruments,현금흐름표 [abstract],투자활동으로 인한 현금흐름,투자활동으로 인한 현금유입액,장기금융상품의 감소,3220136713.0,,
entity00625942_udf_CF_201911101565259_CashFlowsFromUsedInInvestingActivities,투자활동으로 인한 현금유출액,Cash outflow due to investment activity,현금흐름표 [abstract],투자활동으로 인한 현금흐름,투자활동으로 인한 현금유출액,,5901336904.0,23539428913.0,19471922048.0
entity00625942_udf_CF_2019111015119234_udf_CF_201911101565259_CashFlowsFromUsedInInvestingActivities,단기금융상품의 증가,Increase of short-term Financial instruments,현금흐름표 [abstract],투자활동으로 인한 현금흐름,투자활동으로 인한 현금유출액,단기금융상품의 증가,1420580764.0,,548844212.0
entity00625942_udf_CF_20191110151127134_udf_CF_201911101565259_CashFlowsFromUsedInInvestingActivities,장기금융상품의 증가,Increase of long-term Financial instruments,현금흐름표 [abstract],투자활동으로 인한 현금흐름,투자활동으로 인한 현금유출액,장기금융상품의 증가,1214553627.0,1582953576.0,1010304028.0
entity00625942_udf_CF_20191110151151688_udf_CF_201911101565259_CashFlowsFromUsedInInvestingActivities,보증금의 증가,Increase of guaranty money,현금흐름표 [abstract],투자활동으로 인한 현금흐름,투자활동으로 인한 현금유출액,보증금의 증가,53669010.0,1978364000.0,489188000.0
entity00625942_udf_CF_2019111015122634_udf_CF_201911101565259_CashFlowsFromUsedInInvestingActivities,단기대여금의 증가,increase of short-term loans,현금흐름표 [abstract],투자활동으로 인한 현금흐름,투자활동으로 인한 현금유출액,단기대여금의 증가,,486000000.0,
entity00625942_udf_CF_20191110151213698_udf_CF_201911101565259_CashFlowsFromUsedInInvestingActivities,유형자산의 취득,Acquisition of tangible assets,현금흐름표 [abstract],투자활동으로 인한 현금흐름,투자활동으로 인한 현금유출액,유형자산의 취득,2706691820.0,18654351328.0,17115934967.0
entity00625942_udf_CF_20191110151230475_udf_CF_201911101565259_CashFlowsFromUsedInInvestingActivities,무형자산의 취득,Acquisition of intangible assets,현금흐름표 [abstract],투자활동으로 인한 현금흐름,투자활동으로 인한 현금유출액,무형자산의 취득,396101683.0,530159210.0,307650841.0
entity00625942_udf_CF_20191110151251417_udf_CF_201911101565259_CashFlowsFromUsedInInvestingActivities,파생상품의 처분,Disposal of Derivatives,현금흐름표 [abstract],투자활동으로 인한 현금흐름,투자활동으로 인한 현금유출액,파생상품의 처분,109740000.0,,
entity00625942_udf_CF_2020321202253515_udf_CF_201911101565259_CashFlowsFromUsedInInvestingActivities,수익증권의 취득,Acquisition of beneficiary certificates,현금흐름표 [abstract],투자활동으로 인한 현금흐름,투자활동으로 인한 현금유출액,수익증권의 취득,,199600799.0,
entity00625942_udf_CF_2020321202320349_udf_CF_201911101565259_CashFlowsFromUsedInInvestingActivities,상각후측정유가증권의 취득,Acquisition of securities measured after amortization,현금흐름표 [abstract],투자활동으로 인한 현금흐름,투자활동으로 인한 현금유출액,상각후측정유가증권의 취득,,108000000.0,
