"[D520000] Statement of cash flows, indirect method - Consolidated financial statements (Unit: KRW)","[D520000] Statement of cash flows, indirect method - Consolidated financial statements (Unit: KRW)","[D520000] Statement of cash flows, indirect method - Consolidated financial statements (Unit: KRW)","[D520000] Statement of cash flows, indirect method - Consolidated financial statements (Unit: KRW)","[D520000] Statement of cash flows, indirect method - Consolidated financial statements (Unit: KRW)","[D520000] Statement of cash flows, indirect method - Consolidated financial statements (Unit: KRW)",20190101-20191231,20180101-20181231,20170101-20171231
concept_id,label_ko,label_en,class0,class1,class2,"('연결재무제표',)","('연결재무제표',)","('연결재무제표',)"
ifrs-full_CashFlowsFromUsedInOperatingActivities,영업활동현금흐름,Cash flows from (used in) operating activities,현금흐름표 [abstract],영업활동현금흐름,,65163249869.0,10586574238.0,30199583689.0
dart_ProfitLossForStatementOfCashFlows,계속영업반기순이익,Profit (loss),현금흐름표 [abstract],영업활동현금흐름,계속영업반기순이익,5398647998.0,-35260613388.0,-38853888602.0
ifrs-full_AdjustmentsForReconcileProfitLoss,당기순이익조정을 위한 가감,Adjustments to reconcile profit (loss),현금흐름표 [abstract],영업활동현금흐름,당기순이익조정을 위한 가감,66860092369.0,56253641390.0,83096436888.0
dart_AdjustmentsForAssetsLiabilitiesOfOperatingActivities,영업활동으로인한자산ㆍ부채의변동,Adjustments for assets and liabilities of operating activities,현금흐름표 [abstract],영업활동현금흐름,영업활동으로인한자산ㆍ부채의변동,4487426416.0,415288965.0,6325063527.0
ifrs-full_InterestReceivedClassifiedAsOperatingActivities,이자수취(영업),Interest received,현금흐름표 [abstract],영업활동현금흐름,이자수취(영업),482966127.0,582345494.0,735730389.0
ifrs-full_InterestPaidClassifiedAsOperatingActivities,이자지급(영업),Interest paid,현금흐름표 [abstract],영업활동현금흐름,이자지급(영업),8964045697.0,8312216158.0,7692706788.0
ifrs-full_DividendsReceivedClassifiedAsOperatingActivities,배당금수취(영업),Dividends received,현금흐름표 [abstract],영업활동현금흐름,배당금수취(영업),30000000.0,30000000.0,30000000.0
ifrs-full_IncomeTaxesPaidRefundClassifiedAsOperatingActivities,법인세납부(환급),Income taxes paid (refund),현금흐름표 [abstract],영업활동현금흐름,법인세납부(환급),3131837344.0,3121872065.0,7110742193.0
entity00155692_udf_CF_201889113743776_CashFlowsFromUsedInOperatingActivities,중단영업부문 영업활동 현금흐름,Cash flows from (used in) financing activities from discontinued operations,현금흐름표 [abstract],영업활동현금흐름,중단영업부문 영업활동 현금흐름,,,-6330309532.0
ifrs-full_CashFlowsFromUsedInInvestingActivities,투자활동현금흐름,Cash flows from (used in) investing activities,현금흐름표 [abstract],투자활동현금흐름,,-23002651995.0,-14381148519.0,29668064678.0
dart_PurchaseOfShortTermFinancialInstruments,단기금융상품의 취득,Purchase of short term Financial Instruments,현금흐름표 [abstract],투자활동현금흐름,단기금융상품의 취득,525430126.0,-4003398883.0,-5019158113.0
dart_PurchaseOfShortTermLoansAndReceivables,단기대여금및수취채권의 취득,Purchase of short-term loans and receivables,현금흐름표 [abstract],투자활동현금흐름,단기대여금및수취채권의 취득,1537500005.0,1648478262.0,600000000.0
dart_ProceedsFromSalesOfShortTermLoansAndReceivables,단기대여금및수취채권의 처분,Proceeds from sales of short-term loans and receivables,현금흐름표 [abstract],투자활동현금흐름,단기대여금및수취채권의 처분,1537500005.0,600000000.0,2112750000.0
dart_ProceedsFromSalesOfLongTermFinancialInstruments,장기금융상품의 처분,Proceeds from sales of long-term financial instruments,현금흐름표 [abstract],투자활동현금흐름,장기금융상품의 처분,330562285.0,1059781244.0,1674600000.0
dart_PurchaseOfLongTermFinancialInstruments,장기금융상품의 취득,Purchase of long-term financial instruments,현금흐름표 [abstract],투자활동현금흐름,장기금융상품의 취득,180000000.0,40000000.0,457907684.0
dart_PurchaseOfAvailableForSaleFinancialAssets,매도가능금융자산의 취득,Purchase of available-for-sale financial assets,현금흐름표 [abstract],투자활동현금흐름,매도가능금융자산의 취득,,,4619400000.0
dart_ProceedsFromSalesOfAvailableForSaleFinancialAssets,매도가능금융자산의 처분,Proceeds from sales of available-for-sale financial assets,현금흐름표 [abstract],투자활동현금흐름,매도가능금융자산의 처분,,,653464827.0
dart_ProceedsFromSalesOfCurrentFinancialAssetsHeldToMaturity,국공채의 처분,Proceeds from sales of current financial assets held to maturity,현금흐름표 [abstract],투자활동현금흐름,국공채의 처분,12715000.0,9020000.0,735000.0
dart_ProceedsFromSalesOfOtherNonCurrentFinancialAssets,기타포괄손익인식공정가치금융자산의 처분,Proceeds from sales of other non-current financial assets,현금흐름표 [abstract],투자활동현금흐름,기타포괄손익인식공정가치금융자산의 처분,,1066015248.0,
dart_ProceedsFromSalesOfInvestmentsInSubsidiariesJointVenturesAndAssociates,"종속기업, 조인트벤처와 관계기업에 대한 투자자산의 처분","Proceeds from sales of investments in subsidiaries, joint ventures and associates",현금흐름표 [abstract],투자활동현금흐름,"종속기업, 조인트벤처와 관계기업에 대한 투자자산의 처분",,395000000.0,450000000.0
dart_PurchaseOfInvestmentsInSubsidiariesJointVenturesAndAssociates,"종속기업, 조인트벤처와 관계기업에 대한 투자자산의 취득","Purchase of investments in subsidiaries, joint ventures and associates",현금흐름표 [abstract],투자활동현금흐름,"종속기업, 조인트벤처와 관계기업에 대한 투자자산의 취득",,126500000.0,
ifrs-full_ProceedsFromSalesOfPropertyPlantAndEquipmentClassifiedAsInvestingActivities,유형자산의 처분,"Proceeds from sales of property, plant and equipment",현금흐름표 [abstract],투자활동현금흐름,유형자산의 처분,1326087707.0,8005887021.0,21363153976.0
ifrs-full_PurchaseOfPropertyPlantAndEquipmentClassifiedAsInvestingActivities,유형자산의 취득,"Purchase of property, plant and equipment",현금흐름표 [abstract],투자활동현금흐름,유형자산의 취득,24324714870.0,28238412482.0,33469808425.0
ifrs-full_ProceedsFromSalesOfIntangibleAssetsClassifiedAsInvestingActivities,무형자산의 처분,Proceeds from sales of intangible assets,현금흐름표 [abstract],투자활동현금흐름,무형자산의 처분,734946217.0,172768183.0,154380000.0
ifrs-full_PurchaseOfIntangibleAssetsClassifiedAsInvestingActivities,무형자산의 취득,Purchase of intangible assets,현금흐름표 [abstract],투자활동현금흐름,무형자산의 취득,498237948.0,1405165117.0,1864184107.0
dart_ProceedsFromSalesOfLongTermLoansAndReceivables,장기대여금및수취채권의 처분,Proceeds from sales of long-term loans and receivables,현금흐름표 [abstract],투자활동현금흐름,장기대여금및수취채권의 처분,,,190000000.0
dart_DecreaseInGuaranteeDeposits,임차보증금의 감소,Decrease in guarantee deposits,현금흐름표 [abstract],투자활동현금흐름,임차보증금의 감소,121419740.0,670000.0,54148922.0
dart_IncreaseInGuaranteeDeposits,임차보증금의 증가,Increase in guarantee deposits,현금흐름표 [abstract],투자활동현금흐름,임차보증금의 증가,,10000000.0,5962366.0
entity00155692_udf_CF_201881319521945_CashFlowsFromUsedInInvestingActivities,임대보증금의 증가,Increase in guarantee deposits as financial activities,현금흐름표 [abstract],투자활동현금흐름,임대보증금의 증가,,1929895424.0,368472000.0
entity00155692_udf_CF_20181112155954329_CashFlowsFromUsedInInvestingActivities,임대보증금의 감소,Decrease in guarantee deposits as financial activities,현금흐름표 [abstract],투자활동현금흐름,임대보증금의 감소,,-108404000.0,
entity00155692_udf_CF_20188131952011_CashFlowsFromUsedInInvestingActivities,파생상품거래로 인한 현금의 유출,Cash outflow from derivatives trading,현금흐름표 [abstract],투자활동현금흐름,파생상품거래로 인한 현금의 유출,,-46624661.0,
entity00155692_udf_CF_201889114425543_CashFlowsFromUsedInInvestingActivities,중단영업부문 투자현금흐름,Cash flows from (used in) investing activities from discontinued operations,현금흐름표 [abstract],투자활동현금흐름,중단영업부문 투자현금흐름,,,38644464422.0
ifrs-full_CashFlowsFromUsedInFinancingActivities,재무활동현금흐름,Cash flows from (used in) financing activities,현금흐름표 [abstract],재무활동현금흐름,,-23860970626.0,-8997566611.0,-58705608935.0
dart_ProceedsFromShortTermBorrowings,단기차입금의 증가,Proceeds from short term borrowings,현금흐름표 [abstract],재무활동현금흐름,단기차입금의 증가,167613145205.0,126623320940.0,
dart_RepaymentsOfShortTermBorrowings,단기차입금의 상환,Repayments of short term borrowings,현금흐름표 [abstract],재무활동현금흐름,단기차입금의 상환,175682835683.0,128075880696.0,14885817365.0
dart_ProceedsFromLongTermBorrowings,장기차입금의 증가,Proceeds from long term borrowings,현금흐름표 [abstract],재무활동현금흐름,장기차입금의 증가,273094639.0,11484855977.0,
dart_RepaymentsOfLongTermBorrowings,장기차입금의 상환,Repayments of long term borrowings,현금흐름표 [abstract],재무활동현금흐름,장기차입금의 상환,2894899085.0,,9800000000.0
entity00155692_udf_CF_201833085451505_CashFlowsFromUsedInFinancingActivities,유동성장기부채의 상환,Repayment of long-term long-term liabilities,현금흐름표 [abstract],재무활동현금흐름,유동성장기부채의 상환,-7075000010.0,-10540901732.0,-20457636606.0
dart_DecreaseInGuaranteeDepositsAsFinancialActivities,임대보증금의 감소,Decrease in guarantee deposits as financial activities,현금흐름표 [abstract],재무활동현금흐름,임대보증금의 감소,248087000.0,,
dart_ProceedsFromBonds,사채의 증가,Proceeds from bonds,현금흐름표 [abstract],재무활동현금흐름,사채의 증가,,,10902100000.0
dart_RepaymentsOfBonds,사채의 상환,Repayments of bonds,현금흐름표 [abstract],재무활동현금흐름,사채의 상환,883588800.0,6347943100.0,20495492680.0
dart_AcquisitionOfTreasuryShares,자기주식의 취득,Acquisition of treasury shares,현금흐름표 [abstract],재무활동현금흐름,자기주식의 취득,,,3860630000.0
ifrs-full_ProceedsFromGovernmentGrantsClassifiedAsFinancingActivities,정부보조금의 수취,Proceeds from government grants,현금흐름표 [abstract],재무활동현금흐름,정부보조금의 수취,,,50000000.0
dart_RepaymentForGovernmentGrantsClassifiedAsFinancingActivities,정부보조금의 상환,Repayment for government grants classified as financing activities,현금흐름표 [abstract],재무활동현금흐름,정부보조금의 상환,,2141018000.0,
entity00155692_udf_CF_2018512163813449_CashFlowsFromUsedInFinancingActivities,중단영업부문 재무현금흐름,Cash flows from (used in) financing activities from,현금흐름표 [abstract],재무활동현금흐름,중단영업부문 재무현금흐름,,,-55377884.0
entity00155692_udf_CF_201811121552478_CashFlowsFromUsedInFinancingActivities,파생상품거래로인한현금유출,Declusions in derivatives trading,현금흐름표 [abstract],재무활동현금흐름,파생상품거래로인한현금유출,,,-102754400.0
ifrs-full_PaymentsOfFinanceLeaseLiabilitiesClassifiedAsFinancingActivities,금융리스부채의 지급,Payments of finance lease liabilities,현금흐름표 [abstract],재무활동현금흐름,금융리스부채의 지급,4962799892.0,,
ifrs-full_EffectOfExchangeRateChangesOnCashAndCashEquivalents,현금및현금성자산에 대한 환율변동효과,Effect of exchange rate changes on cash and cash equivalents,현금흐름표 [abstract],현금및현금성자산에 대한 환율변동효과,,53572654.0,-8163734008.0,-478503193.0
ifrs-full_IncreaseDecreaseInCashAndCashEquivalents,현금및현금성자산의순증가(감소),Net increase (decrease) in cash and cash equivalents,현금흐름표 [abstract],현금및현금성자산의순증가(감소),,18353199902.0,-20955874900.0,683536239.0
dart_CashAndCashEquivalentsAtBeginningOfPeriodCf,기초현금및현금성자산,Cash and cash equivalents at beginning of period,현금흐름표 [abstract],기초현금및현금성자산,,19321855003.0,40277729903.0,39594193664.0
dart_CashAndCashEquivalentsAtEndOfPeriodCf,기말현금및현금성자산,Cash and cash equivalents at end of period,현금흐름표 [abstract],기말현금및현금성자산,,37675054905.0,19321855003.0,40277729903.0
